info,name,title
　　本报太原5月28日讯（记者姚凡）日前，省银行业协会组织召开个人住房贷款及车辆分期业务调研座谈会。20家银行机构相关负责人参会。,山西经济日报数字报,省银行业协会携手多家银行共商个人房贷及车辆分期业务规范事宜
　　“今年端午假期，以民俗文化、清凉避暑为主题的亲子游更受市民青睐。在目的地选择上，周边游和本地游比较火热，短线游与长线游平分秋色。,山西经济日报数字报,周边游亲子游广受青睐
"　　本报太原5月28日讯（记者王佳）记者近日从省公安厅了解到，该厅党委紧紧围绕与群众切身利益密切相关的生产、生活领域问题，研究出台《省公安厅2025年度“我为群众办实事”重点项目清单》，推出10项“我为群众办实事”项目，涵盖交通管理、治安管理、出入境服务等领域，切实为群众办实事、解难题。
一、居住证全程网办。",山西经济日报数字报,省公安厅出台二〇二五年度“我为群众办实事”重点项目清单
"　　本报太原5月28日讯（记者李若男）近日，记者从太原海关获悉，今年前4个月，我省民营企业进出口总值184.4亿元，占全省进出口总值的比重同比提升6个百分点至39.2%，占比创历史新高。
今年以来，我省民营企业出口保持月度正增长，4月份出口增速进一步提升至32.6%。",山西经济日报数字报,今年前4月我省民企进出口总值184.4亿元
"　　围绕服务全省高质量发展、发展新质生产力、优化营商环境等重点工作，充分运用公证职能手段，积极服务新业态新领域，5月28日，山西省司法厅向社会发布信息，从6个方面部署17项具体工作，进一步推进全省公证工作改革发展，深入开展“公证规范优质”行动。
近日，省委全面依法治省委员会办公室印发《关于进一步全面推进公证工作改革发展的实施意见》（以下简称《实施意见》）。",山西晚报数字报,我省深入开展“公证规范优质”行动
"　　近日，省自然资源厅印发《自然资源领域推动中部地区崛起工作实施方案》，旨在充分发挥自然资源领域推动中部地区崛起的规划引领、要素支撑作用。
《方案》明确2025年着力完成目标：构建“两统一”下自然资源管理和国土空间规划“一张图”。",山西晚报数字报,我省印发方案支撑自然资源领域推动中部地区崛起
"　　省林草局发布公告，即日起至7月31日，面向社会公开征集林草领域涉企行政执法突出问题线索，以全面规范涉企行政执法行为，切实维护企业合法权益，优化法治化营商环境。
此次征集的范围是2024年以来，林草行政执法部门涉企行政执法存在的下列问题线索：乱收费问题、乱罚款问题、乱检查问题、乱查封问题、违规异地执法问题、趋利性执法问题、其他问题。",山西晚报数字报,省林草局公开征集林草领域涉企行政执法突出问题线索
"　　近日，山西晚报·山河+记者从山西省教育厅获悉，为贯彻落实教育部办公厅印发的《关于举办2025年高校“礼敬中华优秀传统文化”宣传教育活动的通知》，山西省教育厅号召全省各高校积极开展“礼敬中华优秀传统文化”宣传教育活动，并于7月31日前报送成果作品。
山西省教育厅将充分激发广大师生参与知识竞答热情。",山西晚报数字报,全省高校开展“礼敬中华优秀传统文化”宣教活动
"　　预计今年端午节期间，高速公路日均流量将达到105万余辆次，最高峰日流量预计在110余万辆次，高速公路总流量将突破300余万辆次；全省道路日均流量将达到210余万辆次，最高峰日流量将突破220万辆次，道路交通总流量将突破600余万辆次。
伴着粽叶和艾草的清香，本周末将迎来端午假期，山西交警结合往年端午假期流量特点和今年交通态势趋势变化，发布交通流量及流量高峰预判，大流量、易缓行路段，高速公路事故多发及高风险点段，交通安全提示等信息。",山西晚报数字报,山西交警支招，让您端午出行“粽”享顺畅
　　山西晚报·山河+讯（记者  孙轶琼）5月27日，“当代博物馆人的文化自信——故宫博物院与山西博物院职工作品展”在故宫博物院延禧宫盛大启幕。文化和旅游部党组成员、故宫博物院院长王旭东宣布展览开幕。,山西晚报数字报,故宫、晋博职工作品展在故宫延禧宫开幕
　　山西晚报·山河＋讯（记者  张磊）5月28日，山西晚报记者从省财政厅获悉，近期，我省干旱少雨，高温大风等极端天气频发，省内多地遭受严重旱情，对居民用水造成一定影响。近日，省财政厅预拨1300万元中央自然灾害救灾资金，全力支持晋城、临汾、运城做好抗旱救灾工作。,山西晚报数字报,我省预拨资金支持晋城等3市抗旱救灾
　　山西晚报·山河+讯（记者  柴旭晖）近日，山西省住房和城乡建设厅发布《租赁住房建设标准（征求意见稿）》，并面向社会公开征求意见。该标准通过11个章节对租赁住房从基地选址到后期维护进行全链条规范，为规范租赁住房建设管理、改善居住品质提供重要技术支撑。,山西晚报数字报,我省规范租赁住房建设 等你来提意见
"　　7年间，山西顺丰阳泉分公司快递员邵瑞强跑了30万公里配送里程，送了18万件大件包裹，将平凡的工作打磨成熠熠生辉的劳模勋章；从昔日“围着锅台转”到如今“持证上岗”，在天镇县阳光职业培训学校培训师富肖艳带领下，越来越多的天镇农村妇女走出大山，依靠技能勤劳致富……“五一”前夕，我省70名全国劳动模范和先进工作者受到表彰，438个集体和个人获省五一劳动奖和省工人先锋号称号。
近年来，新经济组织发展迅速，互联网平台企业和快递企业聚集了网约配送员、快递员、网约车司机、货车司机等大量以灵活就业为主的新就业群体。",山西日报数字报,让“娘家”的温暖触手可及
　　为贯彻落实中央2025年新兴领域“两个覆盖”集中攻坚动员部署会议精神，高质量完成全省集中攻坚工作任务，按照时间表、路线图，省委组织部、省委社会工作部举办全省新兴领域“两个覆盖”集中攻坚启动部署暨业务能力提升视频培训班。本次培训采取视频会议形式，在省委党校设主课堂，各市委党校设分课堂，省市县三级党委组织部、党委社会工作部、“两新”工委委员单位分管负责同志，相关业务处室有关同志和业务骨干，省级以上园区有关同志，部分党建指导员等共2100余人参加培训。,山西日报数字报,全省新兴领域“两个覆盖”集中攻坚部署深入推进
　　为持续深入宣传《信访工作条例》，引导群众依法理性反映诉求，维护正常信访秩序，省信访局组织开展《信访工作条例》系列宣传活动，进一步推进学条例、用条例，在全社会营造“办事依法、遇事找法、解决问题用法、化解矛盾靠法”的良好氛围。图为5月16日，省信访局工作人员走上街头开展“集中宣传月”活动，通过设立咨询台、悬挂宣传横幅、发放宣传资料、面对面答疑等形式，多角度宣传解读政策，增强群众依法信访观念和理性维权意识。,山西日报数字报,省信访局组织开展《信访工作条例》系列宣传活动
　　近年来，省委省政府大力推进农业机械化，全省主要农作物耕种收综合机械化率达76.9%。但与先进省份相比，仍存在一定差距。,山西日报数字报,省政协委员建议：推进农机装备提质升级
　　本报讯 5月25日，由山西省作家协会主办、希望出版社协办的山西省儿童文学高质量发展研讨活动在鲁迅文学院举行。众多专家学者与山西作家共聚一堂，探讨山西儿童文学发展新路径。,山西日报数字报,山西儿童文学高质量发展研讨会在京举行
　　胡俊，中国李大钊研究会秘书长，北京大学李大钊研究中心主任、研究员。李大钊书赠杨子惠对联。,山西日报数字报,【高擎信仰火炬 建功伟大时代——不断推进新时代机关党建高质量发展】铁肩担道义
　　5月27日，山西师范大学晋创想——晋文化传播活动月系列活动拉开帷幕。学生们用朗诵、歌舞、小品等多种形式展现了山西悠久的历史文化。,山西日报数字报,山西师范大学晋创想——晋文化传播活动月系列活动拉开帷幕
　　本报讯（记者任志霞）5月27日，记者从省财政厅获悉，为深入贯彻落实中央八项规定精神，进一步规范公务人员差旅行为，我省本月启动全省公务差旅信息化管理试点工作。试点工作在充分征求意见的基础上，按照自愿参改的原则，选择11个省直部门和4个地市及其所属有关县（市、区）开展先行试点。,山西日报数字报,我省启动公务差旅信息化管理试点工作
